{
  "version": 2.0,
  "success": true,
  "reason": null,
  "content": {
    "data": {
      "edges": {
        "329a6ff4-4e2a-4932-b39c-32c5d847e3c0": {
          "content": {},
          "dst": "b4a3b681-c96b-49ba-a0d5-7a576996e703",
          "id": "329a6ff4-4e2a-4932-b39c-32c5d847e3c0",
          "src": "f62ab0f7-954c-4205-a39d-5f170f6131b7",
          "type": "Passive DNS Records"
        },
        "4be17e67-cc0f-4e28-b39f-3844edb09b68": {
          "content": {},
          "dst": "afd6c37d-1280-48ac-bf2d-46ae4286c54b",
          "id": "4be17e67-cc0f-4e28-b39f-3844edb09b68",
          "src": "4be17e67-cc0f-4e28-b39f-3844edb09b68",
          "type": "Detection-Target connection"
        },
        "7d52abd6-f390-4f7b-8312-6367011b1d93": {
          "content": {},
          "dst": "a5f818c5-68c4-40ec-a574-60bfae787651",
          "id": "7d52abd6-f390-4f7b-8312-6367011b1d93",
          "src": "b4a3b681-c96b-49ba-a0d5-7a576996e703",
          "type": "DNS Record"
        },
        "be5f636f-1189-49ee-906c-2a5aff984283": {
          "content": {},
          "dst": "4be17e67-cc0f-4e28-b39f-3844edb09b68",
          "id": "be5f636f-1189-49ee-906c-2a5aff984283",
          "src": "a5f818c5-68c4-40ec-a574-60bfae787651",
          "type": "Port Scan"
        }
      },
      "nodes": {
        "4be17e67-cc0f-4e28-b39f-3844edb09b68": {
          "content": {
            "hostname": "",
            "ip_str": "52.90.36.58",
            "path": "",
            "port": 23,
            "protocol": "tcp"
          },
          "id": "4be17e67-cc0f-4e28-b39f-3844edb09b68",
          "type": "detection"
        },
        "a5f818c5-68c4-40ec-a574-60bfae787651": {
          "content": {
            "ip_str": "52.90.36.58"
          },
          "id": "a5f818c5-68c4-40ec-a574-60bfae787651",
          "type": "ip"
        },
        "afd6c37d-1280-48ac-bf2d-46ae4286c54b": {
          "content": {
            "name": "telnetd",
            "vendor": "Linux",
            "version": ""
          },
          "id": "afd6c37d-1280-48ac-bf2d-46ae4286c54b",
          "type": "target"
        },
        "b4a3b681-c96b-49ba-a0d5-7a576996e703": {
          "content": {
            "hostname": "telnet.webernets.online"
          },
          "id": "b4a3b681-c96b-49ba-a0d5-7a576996e703",
          "type": "hostname"
        },
        "f62ab0f7-954c-4205-a39d-5f170f6131b7": {
          "content": {
            "hostname": "webernets.online"
          },
          "id": "f62ab0f7-954c-4205-a39d-5f170f6131b7",
          "type": "hostname"
        }
      },
      "paths": [
        [
          "4be17e67-cc0f-4e28-b39f-3844edb09b68",
          "be5f636f-1189-49ee-906c-2a5aff984283",
          "7d52abd6-f390-4f7b-8312-6367011b1d93",
          "329a6ff4-4e2a-4932-b39c-32c5d847e3c0"
        ]
      ]
    },
    "base_url": "https://app.randori.io/myorg"
  },
  "raw": null,
  "inputs": {
    "randori_target_id": "afd6c37d-1280-48ac-bf2d-46ae4286c54b"
  },
  "metrics": {
    "version": "1.0",
    "package": "fn-randori",
    "package_version": "1.0.0",
    "host": "MacBook-Pro.local",
    "execution_time_ms": 6479,
    "timestamp": "2022-11-09 18:42:30"
  }
}